{
  "schema_version": "1.0.0",
  "assessment_id": "44444444-4444-4444-8444-444444444444",
  "survey_id": "11111111-1111-4111-8111-111111111111",
  "asset_copy_id": "asset_demo",
  "pipeline": "fable",
  "provider": "anthropic",
  "model": "configured-fable-model",
  "evidence_package_hash": "aaaaaaaaaaaaaaaaaaaaaaaaaaaaaaaaaaaaaaaaaaaaaaaaaaaaaaaaaaaaaaaa",
  "category": "book",
  "condition": "worn",
  "damage": {"present": false, "types": [], "description": null},
  "identity_candidates": [],
  "recommended_action": "human_review",
  "confidence": 0.72,
  "rationale": "Spine evidence is incomplete.",
  "evidence_refs": ["roomplan_structure"]
}

